{
  "schema": "m-bedrock-bug-report/v2",
  "map": {
    "name": "Defense Challenge",
    "mapVersion": "1.1.1",
    "drive": "https://drive.google.com/file/d/1Y7G96SRBgSkfhlpnm8xFV3VpmzluvWh-/view",
    "baseVersion": "1.21.130",
    "testedVersion": "Static source audit only; runtime not executed"
  },
  "repairBy": "developer",
  "bugs": [
    {
      "id": "BUG-DEF-LEASE-RESET",
      "fixed": false,
      "severity": "blocker",
      "category": "multiplayer-session",
      "foundBy": "ai",
      "title": "Arena reset can remove ticking areas from a newly started run",
      "problem": "The same arena can restart before its prior async reset finishes, allowing old cleanup to remove ticking areas from the new match and break simulation.",
      "expected": "An arena becomes reusable only after reset completes, and old cleanup cannot release resources owned by a newer run.",
      "observed": "A new run can reuse the arena before reset finishes, then the old reset releases the ticking-area lease used by the new run.",
      "reproduction": [
        "Start a Defense match in an arena.",
        "End or reset the match so the arena begins its map reset.",
        "Start a new match in the same arena before reset work finishes.",
        "Confirm the new match loses its arena ticking areas and gameplay simulation can stop."
      ],
      "aiAnalysis": "Arena/session cleanup exposes the arena as reusable before asynchronous reset completion. The next run can reuse the existing ticking-area lease, while the previous run's delayed cleanup still owns a release path and removes that lease underneath the new run.",
      "relevantCode": [
        {
          "file": "behavior_packs/BP/scripts/chunks/chunk-ZDK4WOHG.js",
          "reason": "Owns Defense arena reset, session reuse, and ticking-area lease lifecycle."
        }
      ],
      "suggestedFix": "Keep the arena unavailable until reset completes, or generation-bind ticking-area lease release so old cleanup cannot release a newer run's lease.",
      "mustPreserve": [
        "Existing arena queue and concurrency policy must keep working.",
        "Cleanup from one arena must not affect another active arena."
      ]
    },
    {
      "id": "BUG-DEF-WAVE-RETRY",
      "fixed": false,
      "severity": "blocker",
      "category": "game-flow",
      "foundBy": "ai",
      "title": "Delayed wave can clear before failed spawn retries finish",
      "problem": "A delayed enemy group can be counted as cleared when its first spawn attempt fails, letting the wave advance before the queued retry spawns its enemies.",
      "expected": "A wave remains active while any required enemy spawn is still pending retry.",
      "observed": "Pending group count can reach zero with no live hostiles, so wave-clear logic can run before retry-spawned enemies appear.",
      "reproduction": [
        "Reach Defense Level 15, Wave 3.",
        "Trigger the delayed enemy group while its spawn chunk is not ready.",
        "Let the first spawn attempt fail and queue its retry.",
        "Confirm the wave can advance as cleared before the delayed enemies actually spawn."
      ],
      "aiAnalysis": "WaveScheduler removes the delayed group from pending accounting immediately after the first spawn attempt, while EntityLoader may still own retries. Hostile-clearance reconciliation then sees zero live tagged enemies and can complete the wave even though required spawns remain outstanding.",
      "relevantCode": [
        {
          "file": "behavior_packs/BP/scripts/chunks/chunk-ZDK4WOHG.js",
          "reason": "Contains delayed wave scheduling, spawn retry ownership, hostile accounting, and wave-clear reconciliation."
        }
      ],
      "suggestedFix": "Keep delayed groups pending until spawn retries resolve, and block wave-clear reconciliation while required enemy spawns remain outstanding.",
      "mustPreserve": [
        "Normal successful spawn groups must keep their current wave timing.",
        "Retry logic must remain bounded and arena-scoped."
      ]
    },
    {
      "id": "BUG-DEF-RESPAWN-RECONNECT",
      "fixed": false,
      "severity": "major",
      "category": "player-state",
      "foundBy": "ai",
      "title": "Reconnect bypasses an active combat respawn countdown",
      "problem": "A player can disconnect during the death countdown and reconnect back into active gameplay before the intended respawn delay finishes.",
      "expected": "A reconnecting player with a pending respawn stays in spectator/death state until the existing countdown ends.",
      "observed": "Combat recovery restores spectator state, then a second reconnect path restores survival, loadout, and gameplay position about five ticks later.",
      "reproduction": [
        "Start a Defense match and die during active combat.",
        "Disconnect while the respawn countdown is still running.",
        "Reconnect before the countdown expires.",
        "Confirm the player returns to active gameplay before the original respawn delay finishes."
      ],
      "aiAnalysis": "CombatTracker owns pending respawn state and correctly restores spectator/countdown on reconnect. GameManager independently handles the same reconnect and later restores active gameplay without consulting that pending-respawn owner.",
      "relevantCode": [
        {
          "file": "behavior_packs/BP/scripts/chunks/chunk-ZDK4WOHG.js",
          "reason": "Contains CombatTracker pending respawn handling and GameManager reconnect recovery."
        }
      ],
      "suggestedFix": "Guard active-session reconnect recovery with the existing pending-respawn state so CombatTracker remains the sole owner until the death timer resolves.",
      "mustPreserve": [
        "Normal reconnect outside a death countdown must still restore the active session.",
        "Existing respawn timing must remain unchanged."
      ]
    },
    {
      "id": "BUG-DEF-PRELOAD-INVENTORY",
      "fixed": false,
      "severity": "major",
      "category": "player-state",
      "foundBy": "ai",
      "title": "Reconnect during preload can carry stale inventory into a new match",
      "problem": "A player who disconnects before the fresh-session inventory wipe can reconnect after it and keep ordinary stale items into the new Defense session.",
      "expected": "Every player entering a fresh Defense session passes the same full inventory reset regardless of reconnect timing.",
      "observed": "The preload wipe only affects online players, and reconnect plus later loadout refresh does not clear ordinary items outside managed loadout state.",
      "reproduction": [
        "Carry a recognizable non-session item in an inventory slot.",
        "Start a Defense match, then disconnect before the preload inventory wipe runs.",
        "Reconnect after the wipe while the session is still preloading.",
        "Confirm the stale item remains when the new match reaches buy or gameplay phase."
      ],
      "aiAnalysis": "The fresh-session wipe is implemented as a batch action over players online at one preload tick rather than a per-player session invariant. Reconnect during preload does not reconcile the missed full clear, and later loadout refresh uses a partial managed-item cleanup.",
      "relevantCode": [
        {
          "file": "behavior_packs/BP/scripts/chunks/chunk-ZDK4WOHG.js",
          "reason": "Owns preload inventory clearing, reconnect handling, and later loadout application."
        }
      ],
      "suggestedFix": "Record the fresh-session inventory reset per player and enforce the missed full clear on reconnect before buy or gameplay continuation.",
      "mustPreserve": [
        "Mid-session loadout refresh must not erase unrelated state unless the fresh-session boundary requires it."
      ]
    }
  ]
}
