{
  "schema": "m-bedrock-bug-report/v2",
  "map": {
    "name": "Five Nights at Z Village Level 1",
    "mapVersion": "1.1.0",
    "drive": "https://drive.google.com/file/d/1npTapvqtd_Yyd1gOch6U03SIPzkY-pUK/view",
    "baseVersion": "1.21.130",
    "testedVersion": "Static source audit only; runtime not executed"
  },
  "repairBy": "developer",
  "bugs": [
    {
      "id": "BUG-FNZ1-CINEMATIC-COINS",
      "fixed": false,
      "severity": "major",
      "category": "score-reward",
      "foundBy": "ai",
      "title": "Reconnect during cinematic can carry stale coins into a fresh session",
      "problem": "A player who misses the cinematic inventory reset can reconnect and keep old coin currency, giving the new match an incorrect starting economy.",
      "expected": "Every new-session participant has stale inventory and currency cleared regardless of disconnect or reconnect timing.",
      "observed": "The cinematic clear only affects online players, and later kit reconciliation intentionally preserves daigon:coin.",
      "reproduction": [
        "Have a party member carry one or more daigon:coin items before starting a new session.",
        "Start the arena and disconnect that player while arena loading is still running.",
        "Reconnect after loading completes while the intro cinematic is active.",
        "Check whether the old coin stack is still available when gameplay begins."
      ],
      "aiAnalysis": "Arena loading hands only currently online players to prepareCinematicPlayers, where the full clear occurs. A reconnect during the cinematic misses that reset. Gameplay later reapplies the kit, but its inventory cleanup deliberately excludes daigon:coin, so stale currency survives.",
      "relevantCode": [
        {
          "file": "selected behavior-pack gameplay scripts",
          "reason": "Contain ArenaLoading completion, cinematic player reset, reconnect reconciliation, and kit cleanup that preserves coins."
        }
      ],
      "suggestedFix": "Track completion of the fresh-session reset per participant and replay it on reconnect before cinematic or gameplay continuation.",
      "mustPreserve": [
        "Normal mid-session kit reapplication may continue preserving coins when no fresh-session reset is required."
      ],
      "issueType": "BUG"
    }
  ]
}
