{
  "schema": "m-bedrock-bug-report/v2",
  "map": {
    "name": "Build & Decode",
    "mapVersion": "1.1.1",
    "drive": "https://drive.google.com/file/d/1oP3m7_WpC2GORzCCrOazmhBiWBvnntnI/view",
    "baseVersion": "Not recorded in audit evidence",
    "testedVersion": "Full static/source audit + tester runtime feedback; current Drive artifact v1.1.1"
  },
  "repairBy": "developer",
  "bugs": [
    {
      "id": "BUG-BAD-LOBBY-CREATIVE-SPAWN",
      "fixed": false,
      "severity": "major",
      "category": "player-state",
      "foundBy": "tester",
      "issueType": "BUG",
      "title": "Main-lobby players can remain in Creative mode after spawn",
      "problem": "The selected world defaults players to Creative, while the canonical main-lobby entry path teleports and clears inventory without normalizing gamemode or player abilities. Tester runtime confirms first-spawn players remain Creative. The role system otherwise consistently uses Adventure for lobby/staging/guessers and grants Creative only to the active builder.",
      "expected": "Normal players in the main lobby and non-builder roles are Adventure with normal lobby abilities; Creative is granted only by the active builder role or an explicitly authorized maintenance role.",
      "observed": "The current artifact has world GameType=Creative and ForceGameType disabled. ArenaService.enterMainLobby() teleports and clears the player but does not set Adventure, disable mayfly, or restore mute state. WelcomeManager also does not normalize gamemode. AntiCheatManager contains corrective logic but is not registered by production main.js.",
      "reproduction": [
        "Join Build & Decode v1.1.1 as a normal non-admin player with a fresh/first spawn.",
        "Allow the normal welcome/main-lobby flow to complete.",
        "Check the player's gamemode.",
        "Confirm the player remains in Creative instead of being normalized to the lobby Adventure role."
      ],
      "aiAnalysis": "This is a role-state ownership gap, not only a world-default setting. The selected artifact repeatedly establishes Adventure as the safe non-builder state, but enterMainLobby does not enforce that state. Relying only on changing the world default would still leave stale returning-player state possible.",
      "relevantCode": [
        {
          "file": "behavior_packs/Build_Decode_BP/scripts/modules/arena/ArenaService.js",
          "reason": "enterMainLobby() clears inventory and teleports to HUB without normalizing gamemode/mayfly/mute; other recovery/staging paths explicitly set Adventure and disable mayfly."
        },
        {
          "file": "behavior_packs/Build_Decode_BP/scripts/modules/welcome/WelcomeManager.js",
          "reason": "First-spawn welcome processing eventually routes the player to enterMainLobby but does not enforce player role state itself."
        },
        {
          "file": "behavior_packs/Build_Decode_BP/scripts/main.js",
          "reason": "Production bootstrap does not register AntiCheatManager."
        },
        {
          "file": "behavior_packs/Build_Decode_BP/scripts/modules/anticheat/AntiCheatManager.js",
          "reason": "Contains non-admin Creative/Spectator correction logic but is inactive in the production bootstrap."
        }
      ],
      "suggestedFix": "Make the existing main-lobby entry/recovery owner normalize the complete lobby player state: set Adventure, disable mayfly, restore mute/managed abilities, then clear inventory/equipment and teleport. Continue granting Creative only from the active builder-role owner. Also set the world default gamemode consistently as defense in depth, but do not rely on the world default as the sole fix.",
      "mustPreserve": [
        "Active builders must still receive Creative during their building round.",
        "Guessers and staging players remain Adventure.",
        "Authorized maintenance/admin workflows must keep their explicitly intended privileges.",
        "Reconnect and match recovery remain owned by the existing session lifecycle."
      ]
    },
    {
      "id": "BUG-BAD-FINAL-RESULT-PRESENTATION",
      "fixed": false,
      "severity": "minor",
      "category": "ui-feedback",
      "foundBy": "tester",
      "issueType": "DESIGN_MISMATCH",
      "title": "Authored final-standings presentation is not used at match completion",
      "problem": "The artifact contains a dedicated final-standings UI explicitly authored for the end of a game, but the terminal match flow never invokes it. Runtime testing observes the match ending and returning to the lobby without a dedicated victory/result presentation such as the authored standings surface, title, or victory sound.",
      "expected": "The authored end-of-match presentation is reachable from the completed-match flow so players receive a clear terminal result before the arena resets and returns them to the lobby.",
      "observed": "GuessTheBuildUI.showFinalStandings() is implemented and documented as the end-of-game standings presentation, but no production caller invokes it. ArenaService.finish() commits the result, sends matchSummary() only as chat text, and immediately proceeds into resetArena().",
      "reproduction": [
        "Complete a normal Build & Decode match in v1.1.1.",
        "Observe the completed result is committed and a chat summary may be sent.",
        "Confirm the authored final standings UI is never displayed.",
        "Observe players are reset/returned to the lobby without a dedicated final victory/result presentation."
      ],
      "aiAnalysis": "This is stronger than a general UX preference because the selected artifact itself contains a dedicated showFinalStandings() capability with an explicit end-of-game purpose, yet the playable terminal flow does not route to it.",
      "relevantCode": [
        {
          "file": "behavior_packs/Build_Decode_BP/scripts/modules/guessthebuild/GuessTheBuildUI.js",
          "reason": "Defines showFinalStandings() with the documented purpose 'Show final standings at end of game'."
        },
        {
          "file": "behavior_packs/Build_Decode_BP/scripts/modules/arena/ArenaService.js",
          "reason": "finish() settles the result, sends a chat summary, then immediately calls resetArena() without invoking the authored final standings UI."
        }
      ],
      "suggestedFix": "Route completed matches through the existing final-result presentation owner after durable result settlement and before arena reset. Extend that same UI/presentation owner to handle team Win/Draw semantics and, if desired, add the requested victory title/sound there. Keep one result authority; presentation must consume the already-settled result rather than recalculate winners.",
      "mustPreserve": [
        "Exact-once result settlement and leaderboard persistence.",
        "Correct team Win/Draw semantics from the canonical result.",
        "Automatic cleanup and return to lobby after the presentation window."
      ]
    }
  ]
}
