{
  "schema": "m-bedrock-bug-report/v2",
  "map": {
    "name": "Composite Challenge",
    "mapVersion": "1.1.1",
    "drive": "https://drive.google.com/file/d/1hFF8MaIgsVFBXgh_ll6f2Uoo2Cv3Y_Rr/view",
    "baseVersion": "Not recorded in audit evidence",
    "testedVersion": "Static source audit only; runtime not executed"
  },
  "repairBy": "developer",
  "bugs": [
    {
      "id": "BUG-CMP-TICKING-AREAS",
      "fixed": false,
      "severity": "blocker",
      "category": "performance-stability",
      "foundBy": "ai",
      "title": "Arena-specific ticking areas are declared but never created",
      "problem": "Started arenas never create their declared simulation regions, so distant spawning, pathing, and wave progression depend on player-loaded chunks.",
      "expected": "Each started arena activates its required simulation regions before gameplay depends on remote chunks.",
      "observed": "Only lobby and permission ticking areas are created; the configured per-arena ticking areas are never materialized.",
      "reproduction": [
        "Start a Composite Challenge arena and progress to gameplay that spawns or moves entities far from players.",
        "Keep players away from the remote spawn or pathing region.",
        "Continue until the game depends on that distant simulation region.",
        "Check whether remote spawning, pathing, or wave progression can stop because the arena region is not kept ticking."
      ],
      "aiAnalysis": "Arena configuration defines and offsets per-arena ticking regions, but the only runtime tickingarea-add owner consumes WorldData entries for lobby and permission. No second creation path or persisted arena ticking-area names were found in the selected artifact.",
      "relevantCode": [
        {
          "file": "chunk-WYD2CS7M.js",
          "reason": "Declares and offsets the per-arena ticking-area configuration."
        },
        {
          "file": "chunk-KPA6ZKUE.js",
          "reason": "Contains the only runtime tickingarea-add owner and only applies lobby/permission regions."
        }
      ],
      "suggestedFix": "Create and release the selected arena's declared simulation regions through the existing residency owner before gameplay uses remote chunks.",
      "mustPreserve": [
        "Lobby and permission ticking areas must keep their existing lifecycle."
      ],
      "issueType": "BUG"
    },
    {
      "id": "BUG-CMP-ASYNC-RESET",
      "fixed": false,
      "severity": "blocker",
      "category": "world-interaction",
      "foundBy": "ai",
      "title": "Arena can restart while its asynchronous world reset is still running",
      "problem": "The arena is marked idle before its multi-tick world reset finishes, so a new session can start while old reset work is still changing the map.",
      "expected": "The arena remains unavailable until its reset finishes, or start admission is blocked by the existing reset lock.",
      "observed": "resetGame starts reset work without awaiting it, then publishes idle state while the reset continues over later ticks.",
      "reproduction": [
        "Run a Composite arena and change blocks covered by the arena reset.",
        "End or reset the match.",
        "Start the same arena again before reset processing finishes.",
        "Check whether blocks can continue changing underneath the new session during setup or gameplay."
      ],
      "aiAnalysis": "ResetMapService performs a chunked multi-tick reset, but resetGame discards its Promise and saves the default idle session immediately. Start validation does not consult ResetMapService's reset-in-progress state, so the same arena can be admitted again before mutation ends.",
      "relevantCode": [
        {
          "file": "chunk-2GRFUQFH.js",
          "reason": "Contains ResetMapService, resetGame, idle publication, and start admission logic."
        }
      ],
      "suggestedFix": "Keep the arena unavailable until the existing reset Promise settles, or include the existing reset-in-progress lock in canonical start admission.",
      "mustPreserve": [
        "Arena resets must remain bounded and non-blocking across ticks.",
        "One arena reset must not block unrelated arenas."
      ],
      "issueType": "BUG"
    },
    {
      "id": "BUG-CMP-PRELOAD-INVENTORY",
      "fixed": false,
      "severity": "major",
      "category": "player-state",
      "foundBy": "ai",
      "title": "Reconnect during preload can carry stale inventory into a fresh session",
      "problem": "A player who misses the online-only preload wipe can reconnect and retain ordinary stale items when Composite enters the new session.",
      "expected": "Every player entering a fresh Composite session receives the same full inventory reset regardless of reconnect timing.",
      "observed": "The preload clear only covers online arena players, and later reconnect plus partial loadout refresh does not replay the missed full wipe.",
      "reproduction": [
        "Carry a recognizable non-session item before starting a Composite arena.",
        "Disconnect before the preload inventory clear runs.",
        "Reconnect after the clear while the session is still preloading.",
        "Check whether the stale item remains when preparation or gameplay begins."
      ],
      "aiAnalysis": "The full inventory clear iterates only players online at preload time. Reconnect during preloading restores state and position without clearing inventory, while preparation applies loadouts with clearAllSlots disabled.",
      "relevantCode": [
        {
          "file": "chunk-2GRFUQFH.js",
          "reason": "Owns preload inventory clearing, reconnect handling, and preparation loadout application."
        }
      ],
      "suggestedFix": "Make the fresh-session inventory reset a per-player invariant and reconcile any missed full clear before reconnecting players continue.",
      "mustPreserve": [
        "Normal mid-session loadout refresh must retain its existing scoped cleanup behavior."
      ],
      "issueType": "BUG"
    },
    {
      "id": "BUG-CMP-CROSS-ARENA-FLAG",
      "fixed": false,
      "severity": "major",
      "category": "multiplayer-session",
      "foundBy": "ai",
      "issueType": "BUG",
      "title": "Cleanup in one arena can invalidate another arena's flag carrier",
      "problem": "Ending or resetting one Composite arena can remove another arena's active carrier marker, causing its flag objective to drop or reset unexpectedly.",
      "expected": "Per-arena cleanup changes only the flag carrier state owned by that arena.",
      "observed": "Flag cleanup receives one arena ID but removes the shared carrier tag from every online player in the world.",
      "reproduction": [
        "Run Composite Attack concurrently in Arena A and Arena B.",
        "In Arena B, take the red flag and remain alive as its active carrier.",
        "Complete, retry, or reset Arena A so its flag cleanup runs.",
        "Check whether Arena B drops or returns its flag even though its carrier did not die or disconnect."
      ],
      "aiAnalysis": "Carrier identity is split between arena-local flagStates and the global ctf_composite_attack_flag_carrier tag. FlagService.cleanup(arenaId) removes that tag from all world players, so Arena A cleanup invalidates Arena B's otherwise-valid carrier.",
      "relevantCode": [
        {
          "file": "chunk-2GRFUQFH.js",
          "reason": "Contains Composite Attack flag state, shared carrier tag validation, per-arena transitions, and world-wide cleanup."
        }
      ],
      "suggestedFix": "Scope carrier-tag cleanup to the carrier owned by the target arena, or make the carrier tag arena-specific while keeping flagStates as the authority.",
      "mustPreserve": [
        "Flag death/disconnect recovery must remain per-arena."
      ]
    },
    {
      "id": "BUG-CMP-CROSS-ARENA-FLOOR",
      "fixed": false,
      "severity": "minor",
      "category": "world-interaction",
      "foundBy": "ai",
      "issueType": "BUG",
      "title": "Arena floor maintenance mutates blocks around unrelated players",
      "problem": "An active Composite arena can convert dirt around lobby or other-arena players because its maintenance command targets every player in the world.",
      "expected": "Periodic arena floor maintenance affects only players and world space owned by that active arena.",
      "observed": "Each active arena runs a grass-path fill as @a, so the mutation executes around players outside the arena too.",
      "reproduction": [
        "Keep Player A outside the active Composite arena while standing near dirt.",
        "Start gameplay in Arena B.",
        "Wait for the periodic floor-maintenance interval.",
        "Check whether dirt around Player A changes to grass path despite Player A not belonging to Arena B."
      ],
      "aiAnalysis": "Defense and Attack maintenance loops are entered per active arena, but the fill command executes as global @a. The command therefore escapes arena ownership and mutates nearby world state around unrelated players.",
      "relevantCode": [
        {
          "file": "chunk-2GRFUQFH.js",
          "reason": "Contains the per-arena maintenance loop and global execute as @a fill command."
        }
      ],
      "suggestedFix": "Execute floor maintenance only for the canonical online-player set of the active arena instead of global @a.",
      "mustPreserve": [
        "Existing floor repair around legitimate active-arena players must continue."
      ]
    }
  ]
}
